<?xml version="1.0" encoding="UTF-8"?>
<!DOCTYPE response PUBLIC "-//www.eocencle.org//DTD Config 1.0//EN" "http://www.eocencle.org/winger/dtd/winger-1-response.dtd">
<response contextpath="winger/">
	<json id="result1">
		"say" : "hello wolrd"
	</json>
	<json id="result2">
		"speak" : "you are welcome ${value}"
	</json>
	<branch action="/item/addItem" method="post">
		{
			"meta" : {
				"code" : 1,
				"msg" : "请求成功！",
				"data" : "${value}"
			},
			"data" : {
				<if test="1 == id">
					<include refid="result1" />
				</if>
				<if test="2 == id">
					<include refid="result2" />
				</if>
			}
		}
	</branch>
</response>